{
  "protocol": "factory.certification.v1",
  "protocolVersion": "1.0.0",
  "generatedAt": "2026-07-05T12:00:00Z",
  "tenantId": "horizon",
  "auditId": "audit-20260705-120000",
  "status": "fail",
  "summary": {
    "total": 6,
    "passed": 4,
    "failed": 2,
    "skipped": 0,
    "warnings": 0
  },
  "checks": [
    {
      "id": "check.structure",
      "category": "structure",
      "title": "Repository structure valid",
      "status": "pass"
    },
    {
      "id": "check.secrets",
      "category": "security",
      "title": "No secrets in repository",
      "status": "pass"
    },
    {
      "id": "check.schema",
      "category": "schema",
      "title": "Certification artifacts validate",
      "status": "pass"
    },
    {
      "id": "check.build",
      "category": "health",
      "title": "Build succeeds",
      "status": "fail",
      "evidence": "npm run build exit 1 — missing env template",
      "remediation": "Add .env.example and document required vars",
      "repairPriority": 2
    },
    {
      "id": "check.tests",
      "category": "health",
      "title": "Test suite passes",
      "status": "fail",
      "evidence": "Tests fail without env configuration",
      "remediation": "Fix test setup or provide test fixtures",
      "repairPriority": 2
    },
    {
      "id": "check.docs",
      "category": "documentation",
      "title": "README present",
      "status": "pass"
    }
  ],
  "auditor": {
    "tool": "cursor",
    "version": "1.0.0",
    "operator": "factory-standards-example"
  }
}
